{"record_type":"UNBLINDING_DECISION_RECORD","schema_version":1,"protocol_id":"PDMAL-TRACK-A-TOPOLOGY-ROBUSTNESS-EPOCH-002","epoch":2,"record_id":"E002-UNBLINDING-AD773A5A1B2CB233","generated_at_utc":"2026-09-15T14:23:21Z","producer":{"system":"DGAF_TRACK_A_EPOCH_002_UNBLINDING_DECISION_VALIDATOR","version_or_commit":"ab577b09db9f3d772797e3995e32039ec5e21626"},"immutable_subject":{"commit_sha":"e7ba2fe6fc6b3587957c59231da81ae107cacab2","sha256":"98ab5f1cf1241e0746ef8e9197b05b14b790428998343b702934f1c0556b6d7a"},"evidence_scope":"CONTROLLED_MAPPING_RELEASE_OR_DECRYPTION_ONLY","non_effects":["DOES_NOT_AUTHORIZE_COLLECTION","DOES_NOT_AUTHORIZE_ANALYSIS","DOES_NOT_INCREMENT_SCIENTIFIC_N","DOES_NOT_ESTABLISH_CANONICAL_DGAF_EFFICACY","DOES_NOT_ESTABLISH_INDEPENDENT_VALIDATION","DOES_NOT_AUTHORIZE_HIGH_ASSURANCE"],"status":"PASS","predecessor_record_ids":["E002-DATASET-LOCK-A16973BD7AA9E1EB"],"authorization_effect":"BOUNDED_RECORD_ONLY","scientific_state_effect":{"empirical_n_increment":0,"canonical_dgaf_efficacy":"NOT_ESTABLISHED"}}
