{"authorization_effect":"REQUIRES_SEPARATE_EXACT_COMMIT","epoch":2,"evidence_scope":"CONTENT_ADDRESSED_EPOCH_002_BLINDED_DATASET_LOCK_BEFORE_UNBLINDING","generated_at_utc":"2026-09-15T13:51:11Z","immutable_subject":{"commit_sha":"9ea2edee17cbc463e26afa8866a66db174cebfc0","sha256":"a16973bd7aa9e1ebe58842ca0dee326ab5b66c072dc7e8917885bfcb9e254f2f"},"non_effects":["DOES_NOT_AUTHORIZE_COLLECTION","DOES_NOT_AUTHORIZE_UNBLINDING","DOES_NOT_AUTHORIZE_ANALYSIS","DOES_NOT_INCREMENT_SCIENTIFIC_N","DOES_NOT_ESTABLISH_CANONICAL_DGAF_EFFICACY","DOES_NOT_ESTABLISH_INDEPENDENT_VALIDATION","DOES_NOT_AUTHORIZE_HIGH_ASSURANCE"],"predecessor_record_ids":["E002:QC:RETROSPECTIVE_OPERATOR"],"producer":{"system":"DGAF_TRACK_A_EPOCH_002_DATASET_LOCK_VALIDATOR","version_or_commit":"cae34a3d7c9642da3269e69a2b3121fce78be2dd"},"protocol_id":"PDMAL-TRACK-A-TOPOLOGY-ROBUSTNESS-EPOCH-002","record_id":"E002-DATASET-LOCK-A16973BD7AA9E1EB","record_type":"DATASET_LOCK_RECEIPT","schema_version":1,"scientific_state_effect":{"canonical_dgaf_efficacy":"NOT_ESTABLISHED","empirical_n_increment":0},"status":"PASS"}
