{"authorization_effect":"NONE","epoch":2,"evidence_scope":"LOCKED_PRIMARY_ANALYSIS_OUTPUT_CONTENT_ADDRESS_ONLY","generated_at_utc":"2026-09-19T09:39:00Z","immutable_subject":{"commit_sha":"e87917e644d71de7351c5983fa7ed89d9231962f","sha256":"966fe9f1c218d8f64eae8465288a5e23b332555484eac2602c3764c3172336da"},"non_effects":["DOES_NOT_AUTHORIZE_COLLECTION","DOES_NOT_AUTHORIZE_UNBLINDING","DOES_NOT_AUTHORIZE_ANALYSIS","DOES_NOT_INCREMENT_SCIENTIFIC_N","DOES_NOT_ESTABLISH_CANONICAL_DGAF_EFFICACY","DOES_NOT_ESTABLISH_INDEPENDENT_VALIDATION","DOES_NOT_AUTHORIZE_HIGH_ASSURANCE"],"predecessor_record_ids":["E002-ANALYSIS-AUTH-0001"],"producer":{"system":"DGAF_TRACK_A_EPOCH_002_LOCKED_ANALYSIS_RESULT_VALIDATOR","version_or_commit":"4cfa8e18779d5788d739f37e47892ad43d51cd8d"},"protocol_id":"PDMAL-TRACK-A-TOPOLOGY-ROBUSTNESS-EPOCH-002","record_id":"E002-ANALYSIS-RESULT-0001","record_type":"LOCKED_ANALYSIS_RESULT_RECORD","schema_version":1,"scientific_state_effect":{"canonical_dgaf_efficacy":"NOT_ESTABLISHED","empirical_n_increment":0},"status":"PASS"}
