{"authorization_effect":"REQUIRES_SEPARATE_EXACT_COMMIT","epoch":2,"evidence_scope":"DETERMINISTIC_EPOCH_002_ANALYSIS_INPUT_MATERIALIZATION_AFTER_BOUNDED_UNBLINDING","generated_at_utc":"2026-09-18T15:27:46Z","immutable_subject":{"commit_sha":"0e97a178376cb120ae45a5dad7bdc05d516023f7","sha256":"a4f0001e13784cc6fd0a7203ed34fcde4b864ed56419039ca5cd9d2c13dab55e"},"non_effects":["DOES_NOT_AUTHORIZE_COLLECTION","DOES_NOT_AUTHORIZE_UNBLINDING","DOES_NOT_AUTHORIZE_ANALYSIS","DOES_NOT_INCREMENT_SCIENTIFIC_N","DOES_NOT_ESTABLISH_CANONICAL_DGAF_EFFICACY","DOES_NOT_ESTABLISH_INDEPENDENT_VALIDATION","DOES_NOT_AUTHORIZE_HIGH_ASSURANCE"],"predecessor_record_ids":["E002-UNBLINDING-AD773A5A1B2CB233"],"producer":{"system":"DGAF_TRACK_A_EPOCH_002_MATERIALIZATION_RECEIPT_VALIDATOR","version_or_commit":"0e97a178376cb120ae45a5dad7bdc05d516023f7"},"protocol_id":"PDMAL-TRACK-A-TOPOLOGY-ROBUSTNESS-EPOCH-002","record_id":"E002-MATERIALIZE-55173BFA59ED9E6C","record_type":"MATERIALIZATION_RECEIPT","schema_version":1,"scientific_state_effect":{"canonical_dgaf_efficacy":"NOT_ESTABLISHED","empirical_n_increment":0},"status":"PASS"}
