{"authorization_effect":"BOUNDED_RECORD_ONLY","epoch":2,"evidence_scope":"LOCKED_PRIMARY_ANALYSIS_ONLY","generated_at_utc":"2026-09-18T15:44:00Z","immutable_subject":{"commit_sha":"26af4224b82656734b3f411acf063ab82712cdca","sha256":"849c86562deec3cfa69dbe85c3a68b846814adaeeb011cc371d3848c17e4c03a"},"non_effects":["DOES_NOT_AUTHORIZE_COLLECTION","DOES_NOT_AUTHORIZE_UNBLINDING","DOES_NOT_INCREMENT_SCIENTIFIC_N","DOES_NOT_ESTABLISH_CANONICAL_DGAF_EFFICACY","DOES_NOT_ESTABLISH_INDEPENDENT_VALIDATION","DOES_NOT_AUTHORIZE_HIGH_ASSURANCE"],"predecessor_record_ids":["E002-MATERIALIZE-55173BFA59ED9E6C"],"producer":{"system":"DGAF_TRACK_A_EPOCH_002_PRIMARY_ANALYSIS_AUTHORIZATION_VALIDATOR","version_or_commit":"6658cdc10c6b2e09bc0ef1112a7af3e2caba84e7"},"protocol_id":"PDMAL-TRACK-A-TOPOLOGY-ROBUSTNESS-EPOCH-002","record_id":"E002-ANALYSIS-AUTH-0001","record_type":"PRIMARY_ANALYSIS_AUTHORIZATION_RECORD","schema_version":1,"scientific_state_effect":{"canonical_dgaf_efficacy":"NOT_ESTABLISHED","empirical_n_increment":0},"status":"PASS"}
