{"authorization_effect":"NONE","epoch":2,"evidence_scope":"INTERPRETATION_CONTENT_ADDRESS_ONLY_SAME_SYSTEM_NONINDEPENDENT","generated_at_utc":"2026-09-19T12:40:50Z","immutable_subject":{"commit_sha":"c0690e599d25304f1d920d5235adff04ba76094a","sha256":"7985610b8ac6f8dc7496eb6b3ae16cd7e7ceaa38d5ab9dde86c9a5cc70e68852"},"non_effects":["DOES_NOT_AUTHORIZE_COLLECTION","DOES_NOT_AUTHORIZE_UNBLINDING","DOES_NOT_AUTHORIZE_ANALYSIS","DOES_NOT_INCREMENT_SCIENTIFIC_N","DOES_NOT_ESTABLISH_CANONICAL_DGAF_EFFICACY","DOES_NOT_ESTABLISH_INDEPENDENT_VALIDATION","DOES_NOT_AUTHORIZE_HIGH_ASSURANCE"],"predecessor_record_ids":["E002-ANALYSIS-RESULT-0001"],"producer":{"system":"DGAF_TRACK_A_EPOCH_002_INTERPRETATION_VALIDATOR","version_or_commit":"231a6adff22e77701365adfaa323e4f1377139d4"},"protocol_id":"PDMAL-TRACK-A-TOPOLOGY-ROBUSTNESS-EPOCH-002","record_id":"E002-INTERPRET-0001","record_type":"INTERPRETATION_NOTE","schema_version":1,"scientific_state_effect":{"canonical_dgaf_efficacy":"NOT_ESTABLISHED","empirical_n_increment":0},"status":"PASS"}
